node_id,mag_paper_id,title,class_idx,cluster_id
583,2808195542,deep lip reading a comparison of models and an online application,16,30
584,2808278571,learning 6 dof grasping and pick place using attention focus,27,2
585,2808404826,right for the right reason training agnostic networks,24,30
586,2808768547,latent heterogeneous multilayer community detection,26,1
587,2808815309,probabilistic natural language generation with wasserstein autoencoders,30,20
588,2809032952,calorinet from silhouettes to calorie estimation in private environments,16,30
589,2809353777,binary ensemble neural network more bits per network or more networks per bit,24,30
590,2809678767,stability of kalman filtering with a random measurement equation application to sensor scheduling with intermittent observations,19,25
591,2809716546,solving atari games using fractals and entropy,10,2
592,2810202096,reachability in timed automata with diagonal constraints,2,30
593,2810387969,octen online compression based tensor decomposition,24,30
594,2810533955,neuro symbolic execution the feasibility of an inductive approach to symbolic execution,22,2
595,2810845273,search rank fraud de anonymization in online systems,26,2
596,2810961304,efficient parallel self assembly under uniform control inputs,20,2
597,2811027900,transfer learning for clinical time series analysis using recurrent neural networks,24,30
598,2811034418,computing the metric dimension by decomposing graphs into extended biconnected components,9,35
599,2811456079,asymptotic analysis of spatial coupling coding for compute and forward relaying,28,33
600,2820951506,deepmove learning place representations through large scale movement data,24,30
601,2882892967,derivation of the closed form ber expressions for dl noma over nakagami m fading channels,28,30
602,2883004598,optimization of battery energy storage to improve power system oscillation damping,19,30
603,2884288768,dla compiler and fpga overlay for neural network inference acceleration,5,32
604,2884506312,gated fusion network for joint image deblurring and super resolution,16,30
605,2885850791,visualizing convolutional networks for mri based diagnosis of alzheimer s disease,16,30
606,2886099836,parallelization does not accelerate convex optimization adaptivity lower bounds for non smooth convex minimization,24,30
607,2886216536,cognitive techniques for early detection of cybersecurity events,4,30
608,2886351808,progressive operational perceptron with memory,13,2
609,2886616607,quantified markov logic networks,10,2
610,2886620977,towards a new extracting and querying approach of fuzzy summaries,37,33
611,2886748926,video to video synthesis,16,29
612,2886818025,application of end to end deep learning in wireless communications systems,28,2
613,2886881561,reasoning with justifiable exceptions in contextual hierarchies appendix,10,30
614,2887199985,estimating failure in brittle materials using graph theory,7,2
615,2887256099,towards audio to scene image synthesis using generative adversarial network,30,19
616,2887420797,unsupervised learning of foreground object segmentation,16,35
617,2887806996,deepmag source specific motion magnification using gradient ascent,16,30
618,2888515142,who is really affected by fraudulent reviews an analysis of shilling attacks on recommender systems in real world scenarios,31,2
619,2888639576,stdp learning of image patches with convolutional spiking neural networks,13,36
620,2889642831,rigid body dynamic simulation with multiple convex contact patches,27,32
621,2889678803,a simplicial complex model for dynamic epistemic logic to study distributed task computability,2,30
622,2889681790,data augmentation for neural online chat response selection,30,8
623,2889762385,machine learning for semi linear pdes,24,2
624,2890741595,an energy based analysis of reduced order models of networked synchronous machines,19,2
625,2890762086,xml navigation and transformation by tree walking automata and transducers with visible and invisible pebbles,33,36
626,2891688681,multi context deep network for angle closure glaucoma screening in anterior segment oct,16,2
627,2891754318,reinforcement learning in topology based representation for human body movement with whole arm manipulation,27,35
628,2892009954,deep compressive autoencoder for action potential compression in large scale neural recording,13,30
629,2892085193,i know what you want semantic learning for text comprehension,30,30
630,2892122909,unsupervised cross lingual matching of product classifications,30,2
631,2892212780,decentralized search on decentralized web,31,14
632,2893143132,deeplaser practical fault attack on deep neural networks,4,2
633,2893179710,temporal cliques admit sparse spanners,39,2
634,2893268956,learning to coordinate multiple reinforcement learning agents for diverse query reformulation,24,25
635,2893278801,joint activity detection and channel estimation for iot networks phase transition and computation estimation tradeoff,28,2
636,2893602300,operations on partial orders,2,2
637,2893872548,learning without interaction requires separation,24,28
638,2894612187,cello 3d estimating the covariance of icp in the real world,27,30
639,2894788161,learning depth with convolutional spatial propagation network,16,2
640,2895020057,adversarial examples a complete characterisation of the phenomenon,16,27
641,2895045024,corrections to wyner s common information under r enyi divergence measures,28,30
642,2895669808,indirect mechanism design for efficient and stable renewable energy aggregation,36,32
643,2896257562,neural variational hybrid collaborative filtering,31,30
644,2896790514,analyzing and interpreting convolutional neural networks in nlp,30,31
645,2896992269,real time self adaptive deep stereo,16,2
646,2897025488,a modern take on the bias variance tradeoff in neural networks,24,3
647,2897071425,online learning with feedback graphs and switching costs,24,2
648,2897239789,continual state representation learning for reinforcement learning using generative replay,24,1
649,2897490229,human competitive patches in automatic program repair with repairnator,23,2
650,2897490830,design challenges of multi uav systems in cyber physical applications a comprehensive survey and future directions,27,30
651,2898072074,conceptual organization is revealed by consumer activity patterns,10,2
652,2898132662,improved hybrid ctc attention model for speech recognition,25,2
653,2898201669,physical unclonable function based key sharing for iot security,4,36
654,2898258448,structure learning of deep networks via dna computing algorithm,13,30
655,2898350943,law and adversarial machine learning,24,30
656,2898387785,unsupervised data selection for supervised learning,16,1
657,2898419822,exploiting the laws of order in smart contracts,4,30
658,2899017552,neural music synthesis for flexible timbre control,25,2
659,2900240996,a review for weighted minhash algorithms,34,2
660,2900531094,copy the old or paint anew an adversarial framework for non parametric image stylization,16,30
661,2900579567,fotonnet a hw efficient object detection system using 3d depth segmentation and 2d dnn classifier,16,2
662,2900842112,attention please adversarial defense via attention rectification and preservation,16,2
663,2900949092,lightweight lipschitz margin training for certified defense against adversarial examples,24,1
664,2901174038,practical deep reinforcement learning approach for stock trading,24,1
665,2901469772,pair wise exchangeable feature extraction for arbitrary style transfer,16,25
666,2901574935,on buildings that compute a proposal,18,35
667,2901607659,limited gradient descent learning with noisy labels,24,30
668,2901739041,mixed precision training for nlp and speech recognition with openseq2seq,30,30
669,2901779532,efficient and scalable multi task regression on massive number of tasks,24,30
670,2901978819,a study of the feasibility of co located app attacks against ble and a large scale analysis of the current application layer security landscape,4,35
671,2902240649,model evaluation model selection and algorithm selection in machine learning,24,36
672,2902296270,dense xunit networks,16,1
673,2902497586,document structure measure for hypernym discovery,30,2
674,2902557666,towards secure and efficient payment channels,4,2
675,2902749952,explaining the ambiguity of object detection and 6d pose from visual data,16,4
676,2903004694,adversarial defense by stratified convolutional sparse coding,16,30
677,2903056976,modeling treatment delays for patients using feature label pairs in a time series,24,30
678,2903200123,deepvoxels learning persistent 3d feature embeddings,16,25
679,2903250286,binary sequence set design for interferer rejection in multi branch modulation,28,2
680,2903805326,enumeration structural and dimensional synthesis of robotic hands theory and implementation,27,30
681,2904103890,levy flights of the collective imagination,26,1
682,2904145923,hybrid reinforcement learning with expert state sequences,24,30
683,2905153101,an improvement of paa on trend based approximation for time series,24,2
684,2905487937,the isti rapid response on exploring cloud computing 2018,5,15
685,2906947607,risk aware multi armed bandits using conditional value at risk,24,2
686,2906959110,visibly pushdown languages over sliding windows,33,2
687,2907366400,actor conditioned attention maps for video action detection,16,25
688,2907886055,transfer learning from language models to image caption generators better models may not transfer better,30,2
689,2908544974,non asymptotic fundamental limits of guessing subject to distortion,28,28
690,2908729273,composite shape modeling via latent space factorization,16,30
691,2909002451,storns stochastic radio access network slicing,28,2
692,2909735162,look before you sweep visibility aware motion planning,27,2
693,2910138965,gif2video color dequantization and temporal interpolation of gif images,16,2
694,2910326436,prototypical metric transfer learning for continuous speech keyword spotting with limited training data,25,32
695,2910342249,real time monitoring of social media and digital press,30,2
696,2910869157,on geometric complexity theory multiplicity obstructions are stronger than occurrence obstructions,9,30
697,2911358086,stabilization time in weighted minority processes,39,2
698,2911481909,a data driven method of optimizing feedforward compensator for autonomous vehicle,27,30
699,2911543874,on the capacity region of bipartite and tripartite entanglement switching,8,2
700,2911610870,analysis of data harvesting by unmanned aerial vehicles,28,2
701,2911787152,interpretable neural networks for predicting mortality risk using multi modal electronic health records,24,30
702,2911965419,managing popularity bias in recommender systems with personalized re ranking,31,30
703,2912004605,a deterministic approach to avoid saddle points,24,30
704,2912030092,capacity allocation analysis of neural networks a tool for principled architecture design,24,2
705,2912223035,towards jointly optimal placement and delivery to code or not to code in wireless caching networks,28,2
706,2912477994,situation aware pedestrian trajectory prediction with spatio temporal attention model,16,30
707,2913058692,wikilinkgraphs a complete longitudinal and multi language dataset of the wikipedia link networks,26,2
708,2913079660,learning for dc opf classifying active sets using neural nets,19,30
709,2913547314,exploration of performance and energy trade offs for heterogeneous multicore architectures,5,2
710,2913624634,robustness certificates against adversarial examples for relu networks,24,2
711,2913687563,linear inequality constraints for neural network activations,24,2
712,2913789312,synthesizing facial photometries and corresponding geometries using generative adversarial networks,20,2
713,2914104942,deep learning for bridge load capacity estimation in post disaster and conflict zones,16,30
714,2914233300,confidence trigger detection an approach to build real time tracking by detection system,16,30
715,2914312101,geogan a conditional gan with reconstruction and style loss to generate standard layer of maps from satellite images,16,0
716,2914681686,engineered self organization for resilient robot self assembly with minimal surprise,13,35
717,2914765585,on efficient optimal transport an analysis of greedy and accelerated mirror descent algorithms,34,2
718,2914808443,trust region guided proximal policy optimization,24,1
719,2914898847,deep learning based motion planning for autonomous vehicle using spatiotemporal lstm network,16,2
720,2914949667,automated quality control in image segmentation application to the uk biobank cardiac mr imaging study,16,2
721,2915918561,busyhands a hand tool interaction database for assembly tasks semantic segmentation,16,30
722,2916562010,towards real time eyeblink detection in the wild dataset theory and practices,16,35
723,2916826721,investigating generalisation in continuous deep reinforcement learning,24,2
724,2917138319,robust re identification of manta rays from natural markings by learning pose invariant embeddings,16,2
725,2918130758,coded distributed computing with heterogeneous function assignments,28,2
726,2918696414,bacsoft a tool to archive data on bacteria,18,30
727,2920063196,representative task self selection for flexible clustered lifelong learning,24,2
728,2920431256,graph neural networks for modelling traffic participant interaction,24,2
729,2920741755,rgbd based dimensional decomposition residual network for 3d semantic scene completion,16,35
730,2920887644,styleremix an interpretable representation for neural image style transfer,16,30
731,2921304802,offensive language analysis using deep learning architecture,30,36
732,2921918986,correct by construction control synthesis for buck converters with event triggered state measurement,19,2
733,2921979992,interacting spreading processes in multilayer networks,26,2
734,2922115235,botgraph web bot detection based on sitemap,4,30
735,2922249902,neural network optimized 1 bit precoding for massive mu mimo,28,2
736,2922344980,a distributed observer for a discrete time linear system,19,30
737,2922422516,a new approach for distributed hypothesis testing with extensions to byzantine resilience,19,2
738,2922717338,context constrained accurate contour extraction for occlusion edge detection,16,2
739,2922874720,safety guided deep reinforcement learning via online gaussian process estimation,24,30
740,2923908626,trends challenges and adopted strategies in robocup home 2019 version,27,2
741,2924032504,rescue a framework for real time feedback on behavioral cues using multimodal anomaly detection,6,30
742,2924116063,mixture of pre processing experts model for noise robust deep learning on resource constrained platforms,24,2
743,2925348613,knowledge adaptation for efficient semantic segmentation,16,2
744,2926841917,towards motion invariant authentication for on body iot devices,4,1
745,2928530452,learning matchable colorspace transformations for long term metric visual localization,16,36
746,2928817239,rate optimal denoising with deep neural networks,28,30
747,2929095093,achieving greater concurrency in execution of smart contracts using object semantics,5,2
748,2930003153,curls whey boosting black box adversarial attacks,16,2
749,2930382063,an asymmetric adaptive scl decoder hardware for ultra low error rate polar codes,28,35
750,2932480350,360 panorama synthesis from a sparse set of images with unknown field of view,16,30
751,2933655602,structural scaffolds for citation intent classification in scientific publications,30,25
752,2933714206,semantic nearest neighbor fields monocular edge visual odometry,16,36
753,2934806712,occlusion guided compact template learning for ensemble deep network based pose invariant face recognition,16,30
754,2935117511,proving tree algorithms for succinct data structures,22,30
755,2936295285,unsupervised acoustic unit discovery for speech synthesis using discrete latent variable neural networks,30,30
756,2936520980,learning discriminative model prediction for tracking,16,2
757,2936883713,deepatlas joint semi supervised learning of image registration and segmentation,16,2
758,2936899590,trick or heat attack on amplification circuits to abuse critical temperature control systems,4,2
759,2938696877,learning interpretable disentangled representations using adversarial vaes,24,2
760,2938927628,an efficient formula synthesis method with past signal temporal logic,2,30
761,2939522634,personalized sentence generation using generative adversarial networks with author specific word usage,30,20
762,2940183409,single pixel reconstruction for one stage instance segmentation,16,0
763,2941026327,hog feature extraction from encrypted images for privacy preserving machine learning,16,2
764,2941665138,over the air computation via intelligent reflecting surfaces,28,30
765,2941859709,pan path integral based convolution for deep graph neural networks,24,2
766,2942047809,fake news early detection a theory driven model,30,2
767,2942135187,cascademl an automatic neural network architecture evolution and training algorithm for multi label classification,24,36
768,2942637361,non rigid structure from motion by rank one basis shapes,16,30
769,2942669846,deep ordinal reinforcement learning,24,2
770,2942775600,an efficient intelligent system for the classification of electroencephalography eeg brain signals using nuclear features for human cognitive tasks,24,1
771,2943913916,joint learning of self representation and indicator for multi view image clustering,16,35
772,2944151897,accurate visual localization for automotive applications,16,30
773,2944460305,network coding gaps for completion times of multiple unicasts,34,30
774,2944855023,a convolutional cost sensitive crack localization algorithm for automated and reliable rc bridge inspection,16,32
775,2944983703,temporal attentive alignment for video domain adaptation,16,30
776,2945051179,on cycling risk and discomfort urban safety mapping and bike route recommendations,3,30
777,2945083850,using deep networks and transfer learning to address disinformation,30,2
778,2945584410,combine ppo with nes to improve exploration,24,2
779,2945603434,distributed pattern formation in a ring,5,2
780,2945692665,a hypergraph based approach for the 4 constraint satisfaction problem tractability,39,2
781,2946019926,debiasing word embeddings improves multimodal machine translation,30,2
782,2946044191,fibinet combining feature importance and bilinear feature interaction for click through rate prediction,24,30
783,2946173551,graph searches and their end vertices,34,30
784,2946356375,a survey on the detection of android malicious apps,4,25
785,2946555364,parallel genetic algorithm for planning safe and optimal route for ship,13,2
786,2946584487,recurring concept meta learning for evolving data streams,24,2
787,2946869570,a cross domain transferable neural coherence model,30,30
788,2947091137,quantization loss re learning method,24,30
789,2947219669,a gender analysis of top scientists collaboration behavior evidence from italy,38,36
790,2947221669,task classification model for visual fixation exploration and search,24,1
791,2947224127,temporally coherent full 3d mesh human pose recovery from monocular video,16,2
792,2947461788,a gram gauss newton method learning overparameterized deep neural networks for regression problems,24,2
793,2947477827,coset a benchmark for evaluating neural program embeddings,24,30
794,2947715232,inverse boosting pruning trees for depression detection on twitter,24,1
795,2947756088,quantifying point prediction uncertainty in neural networks via residual estimation with an i o kernel,24,2
796,2948069823,understanding overfitting peaks in generalization error analytical risk curves for l 2 and l 1 penalized interpolation,24,36
797,2948281243,object agnostic suction grasp affordance detection in dense cluster using self supervised learning docx,27,2
798,2948743095,episodic memory in lifelong language learning,24,35
799,2948793189,fast hierarchical neural network for feature learning on point cloud,16,1
800,2948930516,reducing the variance in online optimization by transporting past gradients,24,2
801,2948954099,unsupervised feature learning with k means and an ensemble of deep convolutional neural networks for medical image classification,16,30
802,2948957650,crypto art a decentralized view,3,2
803,2949067336,swim a semantic wiki for mathematical knowledge management,38,2
804,2949089332,distant supervision relation extraction with intra bag and inter bag attentions,30,2
805,2949134419,divide and grow capturing huge diversity in crowd images with incrementally growing cnn,16,2
806,2949188824,pain intensity estimation by a self taught selection of histograms of topographical features,16,2
807,2949194344,group evolution discovery in social networks,26,2
808,2949196298,the greedy spanner is existentially optimal,34,30
809,2949207020,binary decision diagrams for bin packing with minimum color fragmentation,34,30
810,2949225654,base station selections for qos provisioning over distributed multi user mimo links in wireless networks,28,28
811,2949233314,correlation coefficients and semantic textual similarity,30,2
812,2949238931,successive synthesis of latent gaussian trees,28,30
813,2949267240,asymptotic mmse analysis under sparse representation modeling,28,13
814,2949268354,self organized collective motion with a simulated real robot swarm,27,2
815,2949285477,an algorithmic comparison of the hyper reduction and the discrete empirical interpolation method for a nonlinear thermal problem,7,2
816,2949286181,computationally optimal real resource strategies,10,2
817,2949318474,bitcoin meets strong consistency,5,30
818,2949321893,de fragmenting the cloud,5,30
819,2949324607,lombardi drawings of graphs,20,30
820,2949342675,serverless computing one step forward two steps back,5,28
821,2949346849,self learning scene specific pedestrian detectors using a progressive latent model,16,1
822,2949375452,breaking value symmetry,10,30
823,2949403782,correlated resource models of internet end hosts,5,30
824,2949419978,algebraic geometry codes with complementary duals exceed the asymptotic gilbert varshamov bound,28,2
825,2949429487,minimum weight dynamo and fast opinion spreading,26,2
826,2949435980,the closer the better similarity of publication pairs at different co citation levels,38,35
827,2949439788,learning the information divergence,24,30
828,2949441331,effects of high order co occurrences on word semantic similarities,30,2
829,2949461269,misspelling oblivious word embeddings,30,2
830,2949482052,efficient and accurate estimation of lipschitz constants for deep neural networks,24,30
831,2949487521,distributed analysis and load balancing system for grid enabled analysis on hand held devices using multi agents systems,5,2
832,2949510923,provably efficient rl with rich observations via latent state decoding,24,30
833,2949521215,learning without concentration,24,30
834,2949527639,online voltage stability assessment for load areas based on the holomorphic embedding method,7,2
835,2949535701,modanet a large scale street fashion dataset with polygon annotations,16,2
836,2949535778,deep recurrent electricity theft detection in ami networks with random tuning of hyper parameters,10,32
837,2949560367,an efficient algorithm for factoring polynomials over algebraic extension field,14,30
838,2949561737,sophistication vs logical depth,28,2
839,2949577591,probability and asset updating using bayesian networks for combinatorial prediction markets,10,2
840,2949604932,learning multi level hierarchies with hindsight,10,35
841,2949626996,modular networks learning to decompose neural computation,24,1
842,2949717756,evolving symbolic controllers,10,30
843,2949737549,neobility at semeval 2017 task 1 an attention based sentence similarity model,30,2
844,2949758157,dempster s rule for evidence ordered in a complete directed acyclic graph,10,36
845,2949764951,conditions under which conditional independence and scoring methods lead to identical selection of bayesian network models,10,30
846,2949811668,cd phy physical layer security in wireless networks through constellation diversity,4,28
847,2949817159,on board communication based relative localization for collision avoidance in micro air vehicle teams,27,2
848,2949835687,even delta matroids and the complexity of planar boolean csps,9,2
849,2949835790,generalized spatial modulation in indoor wireless visible light communication,28,2
850,2949837236,fast optical flow using dense inverse search,16,30
851,2949837559,improved complexity results on k coloring p_t free graphs,9,2
852,2949859406,parallel recursive state compression for free,34,2
853,2949896890,learning shape abstractions by assembling volumetric primitives,16,32
854,2949916381,losing weight by gaining edges,9,1
855,2949987032,understanding deep image representations by inverting them,16,24
856,2950002111,plug and play decentralized model predictive control,19,30
857,2950013303,multi view machines,24,2
858,2950047432,space constrained interval selection,34,2
859,2950050258,geocoding without geotags a text based approach for reddit,31,30
860,2950064107,improved bounds on restricted isometry constants for gaussian matrices,28,17
861,2950070519,a survey of blockchain frameworks and applications,3,2
862,2950074070,the dilworth number of auto chordal bipartite graphs,39,2
863,2950104062,nearly optimal exploration exploitation decision thresholds,10,30
864,2950108450,leveraging disease progression learning for medical image recognition,16,30
865,2950117535,quality attributes in practice contemporary data,23,2
866,2950125130,factorizing lambdamart for cold start recommendations,24,30
867,2950134120,fuzzy feedback scheduling of resource constrained embedded control systems,21,30
868,2950136222,topsig topology preserving document signatures,31,2
